{
  "manifest_id": "phase1-sample",
  "ontology_version": "v1",
  "source_ids": ["coco2017"],
  "split_versions": {
    "train": "train-v1",
    "val": "val-v1",
    "test_real_heldout": "test-v1"
  },
  "asset_counts": {
    "train": 1,
    "val": 1,
    "test_real_heldout": 0,
    "by_class": {
      "mug": 1,
      "book": 1
    }
  },
  "created_at": "2026-04-08T00:00:00+00:00",
  "classes": [
    {
      "class_id": "mug",
      "canonical_name": "mug",
      "aliases": ["cup"],
      "status": "active"
    },
    {
      "class_id": "book",
      "canonical_name": "book",
      "aliases": [],
      "status": "active"
    }
  ],
  "assets": [
    {
      "asset_id": "asset-1",
      "source_id": "coco2017",
      "original_identifier": "1",
      "relative_path": "images/mug-1.jpg",
      "width": 640,
      "height": 480,
      "split_name": "train",
      "content_hash": "hash-1",
      "review_status": "accepted",
      "annotations": [
        {
          "annotation_id": "asset-1-ann-0",
          "class_id": "mug",
          "source_label": "cup",
          "bbox_xyxy": [10, 12, 90, 112],
          "is_ignored": false
        }
      ]
    },
    {
      "asset_id": "asset-2",
      "source_id": "coco2017",
      "original_identifier": "2",
      "relative_path": "images/book-1.jpg",
      "width": 640,
      "height": 480,
      "split_name": "val",
      "content_hash": "hash-2",
      "review_status": "accepted",
      "annotations": [
        {
          "annotation_id": "asset-2-ann-0",
          "class_id": "book",
          "source_label": "book",
          "bbox_xyxy": [30, 40, 150, 160],
          "is_ignored": false
        }
      ]
    }
  ]
}

