{
  "manifest_id": "phase1-yolo-sample",
  "ontology_version": "v1",
  "source_ids": ["coco2017", "open_images_v7"],
  "split_versions": {
    "train": "train-v1",
    "val": "val-v1",
    "test_real_heldout": "test-v1"
  },
  "asset_counts": {
    "train": 1,
    "val": 1,
    "test_real_heldout": 1,
    "by_class": {
      "mug": 2,
      "book": 1
    }
  },
  "created_at": "2026-04-15T00:00:00+00:00",
  "classes": [
    {
      "class_id": "mug",
      "canonical_name": "mug",
      "aliases": ["cup"],
      "status": "active"
    },
    {
      "class_id": "book",
      "canonical_name": "book",
      "aliases": [],
      "status": "active"
    }
  ],
  "assets": [
    {
      "asset_id": "asset-train",
      "source_id": "coco2017",
      "original_identifier": "1",
      "relative_path": "source/mug-train.jpg",
      "width": 640,
      "height": 480,
      "split_name": "train",
      "content_hash": "hash-train",
      "review_status": "accepted",
      "annotations": [
        {
          "annotation_id": "asset-train-ann-0",
          "class_id": "mug",
          "source_label": "cup",
          "bbox_xyxy": [10, 12, 90, 112],
          "is_ignored": false
        }
      ]
    },
    {
      "asset_id": "asset-val",
      "source_id": "coco2017",
      "original_identifier": "2",
      "relative_path": "source/book-val.jpg",
      "width": 640,
      "height": 480,
      "split_name": "val",
      "content_hash": "hash-val",
      "review_status": "accepted",
      "annotations": [
        {
          "annotation_id": "asset-val-ann-0",
          "class_id": "book",
          "source_label": "book",
          "bbox_xyxy": [30, 40, 150, 160],
          "is_ignored": false
        }
      ]
    },
    {
      "asset_id": "asset-test",
      "source_id": "open_images_v7",
      "original_identifier": "3",
      "relative_path": "source/mug-test.jpg",
      "width": 640,
      "height": 480,
      "split_name": "test_real_heldout",
      "content_hash": "hash-test",
      "review_status": "accepted",
      "annotations": [
        {
          "annotation_id": "asset-test-ann-0",
          "class_id": "mug",
          "source_label": "mug",
          "bbox_xyxy": [5, 10, 55, 80],
          "is_ignored": false
        }
      ]
    }
  ]
}
